number,value,datetime_start,datetime_complete,duration,params_colsample_bytree,params_gamma,params_learning_rate,params_max_depth,params_min_child_weight,params_n_estimators,params_objective,params_reg_alpha,params_reg_lambda,params_subsample,user_attrs_fold_maes,user_attrs_mae_std,state
70,16.458026976891126,2026-08-29 15:15:44.099415,2026-08-29 15:15:58.382152,0 days 00:00:14.282737,0.54343342384084,1.095513401438244,0.02620181517492066,7,7.02915718673952,751,reg:absoluteerror,4.880825444170019e-08,1.637961625882136e-05,0.7919083898601714,"[20.476, 16.1, 12.798]",3.144795916218562,COMPLETE
71,16.47835124647464,2026-08-29 15:15:58.382204,2026-08-29 15:16:11.798832,0 days 00:00:13.416628,0.5415633757105563,1.0301665665793351,0.027056396412541088,7,7.390856087651932,730,reg:absoluteerror,5.719067636600416e-08,1.170755821299091e-06,0.760288545289666,"[20.496, 16.116, 12.823]",3.1430477417946077,COMPLETE
72,16.50962497401041,2026-08-29 15:16:11.798874,2026-08-29 15:16:27.610632,0 days 00:00:15.811758,0.6141002794362318,0.8822568336126617,0.03516180791487473,8,6.20307286417229,747,reg:absoluteerror,1.506183634058026e-07,1.3438720289073887e-05,0.8320697222694637,,,PRUNED
73,16.42758898482212,2026-08-29 15:16:27.610667,2026-08-29 15:16:40.383214,0 days 00:00:12.772547,0.5502026513084077,0.6613397034791817,0.013938740346784332,7,8.571399326024617,676,reg:absoluteerror,2.3030582264993786e-08,4.987756218347994e-05,0.7867338077955686,"[20.44, 16.04, 12.803]",3.1296126755487164,COMPLETE
74,16.481667915142253,2026-08-29 15:16:40.383250,2026-08-29 15:16:51.451072,0 days 00:00:11.067822,0.5125635986981085,0.3769479513064152,0.013217099252899088,6,4.859704023391734,668,reg:absoluteerror,9.83820870701559e-08,5.428737576565026e-05,0.7903298354927689,"[20.517, 16.103, 12.825]",3.1517671644571763,COMPLETE
75,16.470131305794357,2026-08-29 15:16:51.451111,2026-08-29 15:17:04.341353,0 days 00:00:12.890242,0.587645664044416,0.726634523678841,0.01609460839110078,7,10.087212378252865,696,reg:absoluteerror,1.583265218329096e-07,1.7105890278311395e-05,0.7862990726757851,"[20.472, 16.139, 12.799]",3.1412039616802914,COMPLETE
76,16.49843504201007,2026-08-29 15:17:04.341393,2026-08-29 15:17:20.961053,0 days 00:00:16.619660,0.5331739897858292,0.15101336261902454,0.0211908797219103,8,8.093679972559233,813,reg:absoluteerror,2.5303616419256956e-08,0.0001452438635337011,0.8243742044913085,,,PRUNED
77,16.45285223498666,2026-08-29 15:17:20.961140,2026-08-29 15:17:35.093092,0 days 00:00:14.131952,0.5568853265252779,0.5464634661224702,0.01807129368453331,7,9.608148427754804,785,reg:absoluteerror,1.4522700894311498e-08,4.692671250505296e-05,0.8062281107694116,"[20.454, 16.119, 12.785]",3.139629827455895,COMPLETE
78,115198.63324035252,2026-08-29 15:17:35.093128,2026-08-29 15:17:37.004390,0 days 00:00:01.911262,0.6007137423790543,0.6270313313095437,0.017710489085402393,9,9.333345678837427,596,reg:pseudohubererror,1.8357488235827972e-08,4.1587075244798165e-05,0.8039166141576347,,,PRUNED
79,18.638439567637597,2026-08-29 15:17:37.004415,2026-08-29 15:17:43.300095,0 days 00:00:06.295680,0.5564578356368038,1.12218664155439,0.03170514479046328,7,8.457876306436706,765,reg:squarederror,1.3127240591318867e-06,1.7521418751051724e-06,0.7611095031665984,,,PRUNED
