number,value,datetime_start,datetime_complete,duration,params_colsample_bytree,params_learning_rate,params_max_depth,params_min_child_samples,params_min_split_gain,params_n_estimators,params_num_leaves,params_objective,params_reg_alpha,params_reg_lambda,params_subsample,user_attrs_fold_maes,user_attrs_mae_std,state
77,18.452530211291794,2026-08-29 14:33:29.873617,2026-08-29 14:33:53.745089,0 days 00:00:23.871472,0.6334592643647495,0.03020720907793942,16,42,0.15644844866265273,609,168,regression_l1,1.0255167534382645e-07,0.011276315511269872,0.854797374158299,,,PRUNED
78,18.41171750703172,2026-08-29 14:33:53.745178,2026-08-29 14:34:06.986485,0 days 00:00:13.241307,0.6156807755065398,0.012907284498448619,-1,62,0.5510540331733059,448,182,regression_l1,3.620502293881957,0.2632695785689253,0.83607424932935,,,PRUNED
79,75.8161042764938,2026-08-29 14:34:06.986506,2026-08-29 14:34:17.219135,0 days 00:00:10.232629,0.73491731948594,0.014462911505672102,14,29,0.35304674683056614,504,142,huber,4.273457637228169e-08,1.120156365012878,0.8144363887827035,,,PRUNED
