number,value,datetime_start,datetime_complete,duration,params_colsample_bytree,params_dist,params_eta,params_gamma,params_max_depth,params_min_child_weight,params_n_estimators,params_reg_alpha,params_reg_lambda,params_scale,params_subsample,state
82,0.057300301770333496,2026-08-30 23:54:32.864389,2026-08-30 23:54:39.148070,0 days 00:00:06.283681,0.905824425017454,normal,0.02509707605310791,0.21052933083853909,4,9.724078531286427,645,1.5234017768743238,0.021776568941342417,0.5,0.8207856520925865,COMPLETE
83,0.057370680981969645,2026-08-30 23:54:39.148112,2026-08-30 23:54:45.763220,0 days 00:00:06.615108,0.9039544174354889,normal,0.0249730332759028,0.02301502217195503,4,9.669991219822307,686,0.6007219920093995,0.020618059396529154,0.5,0.8740320900845836,COMPLETE
84,0.057608325564556855,2026-08-30 23:54:45.763261,2026-08-30 23:54:52.382298,0 days 00:00:06.619037,0.9049698291085625,normal,0.025423717703758286,0.02126980683882648,4,11.835455985874402,688,0.6351002743799234,0.019250078737362442,0.5,0.8722460184341218,COMPLETE
85,0.057358097176154976,2026-08-30 23:54:52.382339,2026-08-30 23:54:58.933767,0 days 00:00:06.551428,0.9165170658624326,normal,0.02113501625664157,0.007118855523340788,4,9.752777682536962,668,0.9874241229428977,0.022994983908108075,0.5,0.9287229740037142,COMPLETE
86,0.08319957914272962,2026-08-30 23:54:58.933808,2026-08-30 23:55:05.414034,0 days 00:00:06.480226,0.9189329082918514,normal,0.020640011751183896,0.0064012075625352405,4,13.908500026998658,670,0.9641128370721198,0.014460457233033356,1.0,0.9555873455454702,COMPLETE
87,0.057957098923329405,2026-08-30 23:55:05.414076,2026-08-30 23:55:12.361832,0 days 00:00:06.947756,0.8786724969943243,normal,0.015497070411985192,0.004488267527535527,4,9.76727247087325,700,0.44005597467193774,0.04589985848858214,0.5,0.9230607933513238,COMPLETE
88,0.11615733956253944,2026-08-30 23:55:12.361873,2026-08-30 23:55:17.437147,0 days 00:00:05.075274,0.9399727791173073,normal,0.01743247744729425,0.011173498050776231,3,11.413150345484834,605,1.7662489034591689,0.017569529413270384,2.0,0.8214454885454194,COMPLETE
89,0.057449022488144964,2026-08-30 23:55:17.437188,2026-08-30 23:55:23.810627,0 days 00:00:06.373439,0.8972357311381036,normal,0.031046899119413524,0.011921369175392587,4,8.751592278969657,673,0.493297333387528,7.8212231934205585,0.5,0.9754397451688106,COMPLETE
90,0.5057677883034885,2026-08-30 23:55:23.810666,2026-08-30 23:55:27.151446,0 days 00:00:03.340780,0.9493470055715165,logistic,0.02106565830495637,0.009095377953922613,4,16.595361564622717,639,1.031213877295218,0.5729511192026532,0.5,0.9003807862048167,COMPLETE
91,0.05717767199011805,2026-08-30 23:55:27.151487,2026-08-30 23:55:33.543478,0 days 00:00:06.391991,0.8951716720050472,normal,0.03288713783388177,0.015449263936684885,4,9.148036207070026,669,0.5213024593526718,5.63055290622486,0.5,0.9625301964909504,COMPLETE
92,0.05750326583301194,2026-08-30 23:55:33.543519,2026-08-30 23:55:40.112558,0 days 00:00:06.569039,0.9106183730290921,normal,0.03109051490660483,0.016094881057228734,4,9.659688340215133,686,0.6944782765864038,3.3106185009232383,0.5,0.9448087387805323,COMPLETE
93,0.058379681611444655,2026-08-30 23:55:40.112599,2026-08-30 23:55:43.379417,0 days 00:00:03.266818,0.9138285330369152,normal,0.02553033550137925,0.013020954442813844,4,8.06593637526079,283,0.18719465388552875,9.091943710292794,0.5,0.9764880948462573,COMPLETE
94,0.05714745929091308,2026-08-30 23:55:43.379460,2026-08-30 23:55:49.371356,0 days 00:00:05.991896,0.8929407583298141,normal,0.03318706557481117,0.0035761078278398165,4,12.440161080103117,629,0.2644311339702929,0.024560013714986183,0.5,0.7877403617056205,COMPLETE
95,0.13683626792185685,2026-08-30 23:55:49.371403,2026-08-30 23:55:55.016627,0 days 00:00:05.645224,0.8386852169068546,normal,0.03402034068267109,0.003235406468474751,4,12.802716899432118,623,0.3256209636238216,0.024998466109701304,3.0,0.7906551264348431,COMPLETE
96,0.05775613832071811,2026-08-30 23:55:55.016680,2026-08-30 23:56:02.009140,0 days 00:00:06.992460,0.8738122714468416,normal,0.01844178324845895,0.0021915245304980078,4,10.896814750667103,663,0.25913229275869604,0.02147792339220164,0.5,0.7814859863172631,COMPLETE
97,0.057446695683301324,2026-08-30 23:56:02.009208,2026-08-30 23:56:09.245711,0 days 00:00:07.236503,0.9626295852673233,normal,0.022416504040210176,0.00378287529087615,4,8.874898902477868,644,0.58979858593561,6.678420027081827,0.5,0.9221443117602492,COMPLETE
98,0.057570859157629585,2026-08-30 23:56:09.245938,2026-08-30 23:56:16.212664,0 days 00:00:06.966726,0.933225282756631,normal,0.024527808141522976,0.006716348945950159,4,6.879081729132977,666,0.4679285027941855,1.723089220828575,0.5,0.9957910969561259,COMPLETE
99,0.05803706467156547,2026-08-30 23:56:16.212711,2026-08-30 23:56:23.194750,0 days 00:00:06.982039,0.8957924410707881,normal,0.01206705390724267,0.20914560708148644,4,11.686457984284875,627,0.4119928049126788,0.010535457145823882,0.5,0.832422501745696,COMPLETE
100,0.11880783916839684,2026-08-30 23:56:23.194796,2026-08-30 23:56:30.178482,0 days 00:00:06.983686,0.9999642598401809,extreme,0.04064944061696179,0.0014728133469141403,4,17.524111562979083,682,0.7997979970383473,0.03329888680475405,1.5,0.9310809469602613,COMPLETE
101,0.05773951388075857,2026-08-30 23:56:30.178525,2026-08-30 23:56:37.208071,0 days 00:00:07.029546,0.9043310952692393,normal,0.046018763471279894,0.028725845577865054,5,10.131931017232839,610,0.0019491858993575962,0.013971937817716799,0.5,0.8023803460779634,COMPLETE
102,0.05711991978913911,2026-08-30 23:56:37.208114,2026-08-30 23:56:43.187174,0 days 00:00:05.979060,0.8862215735350104,normal,0.028251702804830504,0.009428880791012055,4,9.141347268892847,594,1.0499515796891716,0.02764071130382143,0.5,0.7632634338734492,COMPLETE
103,0.05742351052329875,2026-08-30 23:56:43.187220,2026-08-30 23:56:49.183477,0 days 00:00:05.996257,0.884744462003152,normal,0.028334484822875473,0.00884736722304965,4,9.177822088658893,597,1.1793153413023858,0.038516507510737104,0.5,0.7626919796855395,COMPLETE
104,0.05706610532156455,2026-08-30 23:56:49.183522,2026-08-30 23:56:55.642315,0 days 00:00:06.458793,0.9210771365358472,normal,0.03179778773147283,0.0057157207918051905,4,7.879240327755574,649,2.1443352482156945,0.02973108661953819,0.5,0.7843970539671808,COMPLETE
105,0.0572606119286052,2026-08-30 23:56:55.642357,2026-08-30 23:57:01.383804,0 days 00:00:05.741447,0.9547486328193504,normal,0.03303439088380374,0.004189138146514738,4,7.273989581664303,579,2.285425794181385,18.6569009202035,0.5,0.7842199597720825,COMPLETE
106,0.057510704792434614,2026-08-30 23:57:01.383852,2026-08-30 23:57:07.175210,0 days 00:00:05.791358,0.981870213865733,normal,0.032716921492058335,0.004369029967398203,4,7.749657914618593,572,2.265302124544545,18.504950562309787,0.5,0.7767215867088778,COMPLETE
107,0.05705945200492243,2026-08-30 23:57:07.175251,2026-08-30 23:57:12.885561,0 days 00:00:05.710310,0.955577235806876,normal,0.03598887521354965,0.0026927775165225794,4,5.978828845953281,579,2.838407634755732,13.701417302301149,0.5,0.7854603117819988,COMPLETE
108,0.08293312052080394,2026-08-30 23:57:12.885605,2026-08-30 23:57:18.513688,0 days 00:00:05.628083,0.8575617871505635,normal,0.03062694462336211,0.0028416130160803,4,6.008893974151833,580,2.9292876667658834,10.850085531275939,1.0,0.7926822045744722,COMPLETE
109,0.05683624694335653,2026-08-30 23:57:18.513731,2026-08-30 23:57:24.216370,0 days 00:00:05.702639,0.9654835850702895,normal,0.03572924815064539,0.005456959738945276,4,5.531976021844972,539,4.334707480459824,15.876430367525316,0.5,0.7840932169897824,COMPLETE
110,0.057836061819326344,2026-08-30 23:57:24.216446,2026-08-30 23:57:29.169062,0 days 00:00:04.952616,0.989937339017988,normal,0.03617720794906686,0.0017836901435925659,3,5.537931727622932,593,4.445294035713662,19.818911917127664,0.5,0.8170640909875365,COMPLETE
111,0.05712048400974092,2026-08-30 23:57:29.169104,2026-08-30 23:57:34.611963,0 days 00:00:05.442859,0.9672888945009995,normal,0.03899979285031731,0.0053938790305284355,4,6.841071292006614,540,3.3467045703525997,5.651767656497929,0.5,0.7851572553258331,COMPLETE
112,0.057295902252957547,2026-08-30 23:57:34.612004,2026-08-30 23:57:40.025268,0 days 00:00:05.413264,0.9400278900273971,normal,0.038907613336388785,0.005445918539597294,4,6.8070097478595635,539,3.821482541022333,5.848623774196049,0.5,0.7874660392178247,COMPLETE
113,0.05711203954681293,2026-08-30 23:57:40.025308,2026-08-30 23:57:45.510745,0 days 00:00:05.485437,0.9401343403429078,normal,0.03846423613807794,0.004918303439695272,4,6.122574679690111,548,3.362667479889501,5.331667753195009,0.5,0.7834998311616826,COMPLETE
114,0.057310517022421986,2026-08-30 23:57:45.510787,2026-08-30 23:57:50.893939,0 days 00:00:05.383152,0.926472086679619,normal,0.04185830043685162,0.005305353819132153,4,6.131631472390386,533,3.464262348107413,5.508090683421945,0.5,0.7842321934085785,COMPLETE
115,0.057281924703994756,2026-08-30 23:57:50.893987,2026-08-30 23:57:56.075866,0 days 00:00:05.181879,0.9435282592660286,normal,0.03782405826241222,0.0054116784350648735,4,4.690886427075554,513,3.941773873972437,4.684723419106957,0.5,0.7578043164518019,COMPLETE
116,0.11427638786363825,2026-08-30 23:57:56.075907,2026-08-30 23:58:01.439278,0 days 00:00:05.363371,0.9408358253649574,normal,0.044474965686110174,0.005561728419559588,4,4.545812811178581,539,3.191580800546905,4.479198056603803,2.0,0.7582210973464506,COMPLETE
117,0.30212113334549506,2026-08-30 23:58:01.439318,2026-08-30 23:58:04.261132,0 days 00:00:02.821814,0.9489882557320384,logistic,0.039144637524150115,0.004189330730551934,4,5.4577498347497135,518,4.020799168056817,11.537710587710759,0.5,0.7501245259632724,COMPLETE
118,0.05722966206487201,2026-08-30 23:58:04.261174,2026-08-30 23:58:09.149685,0 days 00:00:04.888511,0.9315172804692551,normal,0.05122024191614606,0.003700289819027059,4,5.114479773970535,485,2.5554199221357647,2.7787685324549134,0.5,0.7725839900531951,COMPLETE
119,0.13133407686065235,2026-08-30 23:58:09.149724,2026-08-30 23:58:13.872855,0 days 00:00:04.723131,0.9291683438962548,normal,0.05828594916334782,0.003196855687501929,4,3.951902765424012,475,2.565035794831565,15.6832268383403,3.0,0.7735151146801447,COMPLETE
