number,value,datetime_start,datetime_complete,duration,params_colsample_bytree,params_gamma,params_learning_rate,params_max_depth,params_min_child_weight,params_n_estimators,params_objective,params_reg_alpha,params_reg_lambda,params_subsample,user_attrs_fold_maes,user_attrs_mae_std,state
70,681.7028056580435,2026-08-29 15:37:26.106055,2026-08-29 15:37:54.319119,0 days 00:00:28.213064,0.8496471317458203,4.45442250431636,0.012186513485287879,7,4.794796431754168,1349,reg:absoluteerror,1.9050026827548299,0.015500438777491786,0.6002149080550456,"[734.863, 660.366, 649.88]",37.83265355840617,COMPLETE
71,745.5027962738113,2026-08-29 15:37:54.319244,2026-08-29 15:38:10.325426,0 days 00:00:16.006182,0.8710054838113226,4.519418504152848,0.2968182554924997,7,5.111449938591089,1345,reg:absoluteerror,2.482978078133351,0.016499647079417964,0.6399448248922418,,,PRUNED
72,680.5559232622805,2026-08-29 15:38:10.325465,2026-08-29 15:38:45.046258,0 days 00:00:34.720793,0.8477027244358877,3.8015125845464155,0.012284484540509552,8,3.0835058892414713,1364,reg:absoluteerror,2.8908185929789627,0.002174077675933362,0.6016609800405641,"[732.428, 661.427, 647.814]",37.09739230170759,COMPLETE
73,683.1990353402574,2026-08-29 15:38:45.046415,2026-08-29 15:39:19.284302,0 days 00:00:34.237887,0.8763955962192941,3.7630621635714085,0.014684518384447637,8,1.6132919516297375,1396,reg:absoluteerror,0.41574873460119094,0.0025440543618159015,0.6392072793644519,"[734.748, 661.467, 653.382]",36.600047900516,COMPLETE
74,682.957326958097,2026-08-29 15:39:19.284452,2026-08-29 15:39:53.847253,0 days 00:00:34.562801,0.9180573542010207,3.195467031498487,0.013126298560667948,9,2.977551371284752,1184,reg:absoluteerror,3.753198791412179,0.02506142145480917,0.602173058818458,"[735.144, 662.233, 651.496]",37.16064702020766,COMPLETE
75,681.4558714358446,2026-08-29 15:39:53.847394,2026-08-29 15:40:21.155344,0 days 00:00:27.307950,0.8991800564044726,3.803821301135976,0.01906975194603311,8,6.110927158347708,1325,reg:absoluteerror,1.1511468982238742,0.0015117591256056094,0.6138851274132875,"[731.608, 660.361, 652.399]",35.61139905021582,COMPLETE
76,680.4168339061912,2026-08-29 15:40:21.155455,2026-08-29 15:40:48.229812,0 days 00:00:27.074357,0.8424507515147813,3.704531767400313,0.019215743169292986,8,7.163535078368473,1368,reg:absoluteerror,1.3046460481556323,0.001061481512369749,0.6520658859679996,"[731.555, 660.765, 648.931]",36.48115636090198,COMPLETE
77,680.3881651379844,2026-08-29 15:40:48.229849,2026-08-29 15:41:15.513968,0 days 00:00:27.284119,0.8305602310958836,4.162771720387289,0.011295755858019105,8,6.951893463891749,1372,reg:absoluteerror,1.3997736247157686,0.00790227074215849,0.6566496832810134,"[732.746, 659.734, 648.685]",37.29608218957624,COMPLETE
78,682.0628009099041,2026-08-29 15:41:15.514103,2026-08-29 15:41:39.261634,0 days 00:00:23.747531,0.8202395754074044,4.092078377397421,0.01146295526761744,7,7.021212856014149,1377,reg:absoluteerror,1.5470450143236238,0.0061411114716022515,0.6385150120444312,"[735.058, 660.93, 650.2]",37.72840837580596,COMPLETE
79,681.9589464415008,2026-08-29 15:41:39.261679,2026-08-29 15:42:13.173275,0 days 00:00:33.911596,0.782177018622701,3.711618897185731,0.0156589926412408,9,7.105640857039352,1354,reg:absoluteerror,0.48956707593276033,0.0003593905089497553,0.6577436263404657,"[732.864, 659.559, 653.454]",36.08146069371682,COMPLETE
